{
  "schema_version": 1,
  "suite_id": "dprauto-crosslang-60-20260902",
  "visibility": "evaluator_only",
  "reviewed_on": "2026-09-02",
  "review_policy": "Every expected path is checked against the frozen source. Source-audited overrides include documentation or CI evidence. Records are agent-reviewed and must not be represented as human-approved until a person signs them off.",
  "cases": [
    {
      "case_id": "cpp-skypjack--entt",
      "repository": "skypjack/entt",
      "revision": "85c6bba014049b5de8fad49d25424df2f1f6a8c1",
      "review_status": "agent_reviewed",
      "primary_component_ids": [
        "primary"
      ],
      "components": [
        {
          "component_id": "primary",
          "root": ".",
          "role": "primary",
          "languages": [
            "C++"
          ],
          "build_entries": [
            {
              "path": "CMakeLists.txt",
              "build_system": "cmake",
              "role": "primary"
            }
          ],
          "evidence": [
            {
              "path": "CMakeLists.txt",
              "kind": "build_file"
            }
          ]
        }
      ]
    },
    {
      "case_id": "cpp-google--guetzli",
      "repository": "google/guetzli",
      "revision": "214f2bb42abf5a577c079d00add5d6cc470620d3",
      "review_status": "agent_reviewed",
      "primary_component_ids": [
        "primary"
      ],
      "components": [
        {
          "component_id": "primary",
          "root": ".",
          "role": "primary",
          "languages": [
            "C++"
          ],
          "build_entries": [
            {
              "path": "Makefile",
              "build_system": "make",
              "role": "primary"
            },
            {
              "path": "premake5.lua",
              "build_system": "premake",
              "role": "alternative"
            }
          ],
          "evidence": [
            {
              "path": "Makefile",
              "kind": "build_file"
            },
            {
              "path": "premake5.lua",
              "kind": "build_file"
            }
          ]
        }
      ]
    },
    {
      "case_id": "cpp-sqlitebrowser--sqlitebrowser",
      "repository": "sqlitebrowser/sqlitebrowser",
      "revision": "da45c7d528c38986a271fa7be887f95f5b68facb",
      "review_status": "agent_reviewed",
      "primary_component_ids": [
        "primary"
      ],
      "components": [
        {
          "component_id": "primary",
          "root": ".",
          "role": "primary",
          "languages": [
            "C++"
          ],
          "build_entries": [
            {
              "path": "CMakeLists.txt",
              "build_system": "cmake",
              "role": "primary"
            }
          ],
          "evidence": [
            {
              "path": "CMakeLists.txt",
              "kind": "build_file"
            }
          ]
        }
      ]
    },
    {
      "case_id": "cpp-strukturag--libde265",
      "repository": "strukturag/libde265",
      "revision": "c45b2da8f4b6e2b7bf9df1197e5633fbe6adc928",
      "review_status": "agent_reviewed",
      "primary_component_ids": [
        "primary"
      ],
      "components": [
        {
          "component_id": "primary",
          "root": ".",
          "role": "primary",
          "languages": [
            "C++"
          ],
          "build_entries": [
            {
              "path": "CMakeLists.txt",
              "build_system": "cmake",
              "role": "primary"
            }
          ],
          "evidence": [
            {
              "path": "CMakeLists.txt",
              "kind": "build_file"
            }
          ]
        }
      ]
    },
    {
      "case_id": "cpp-treefrogframework--treefrog-framework",
      "repository": "treefrogframework/treefrog-framework",
      "revision": "f54f60220aa4b10ed69d541a3a3547259fc695c4",
      "review_status": "agent_reviewed",
      "primary_component_ids": [
        "primary"
      ],
      "components": [
        {
          "component_id": "primary",
          "root": ".",
          "role": "primary",
          "languages": [
            "C++"
          ],
          "build_entries": [
            {
              "path": "configure",
              "build_system": "autotools",
              "role": "primary"
            }
          ],
          "evidence": [
            {
              "path": "configure",
              "kind": "build_file"
            }
          ]
        }
      ]
    },
    {
      "case_id": "cpp-ipkn--crow",
      "repository": "ipkn/crow",
      "revision": "2b43d3cd6a9a9cdbc99dfef9b86ff3f3027f3d1f",
      "review_status": "agent_reviewed",
      "primary_component_ids": [
        "primary"
      ],
      "components": [
        {
          "component_id": "primary",
          "root": ".",
          "role": "primary",
          "languages": [
            "C++"
          ],
          "build_entries": [
            {
              "path": "CMakeLists.txt",
              "build_system": "cmake",
              "role": "primary"
            }
          ],
          "evidence": [
            {
              "path": "CMakeLists.txt",
              "kind": "build_file"
            }
          ]
        }
      ]
    },
    {
      "case_id": "cpp-drogonframework--drogon",
      "repository": "drogonframework/drogon",
      "revision": "acb39fa39d37474142b80c888dc72a0953dc79c1",
      "review_status": "agent_reviewed",
      "primary_component_ids": [
        "primary"
      ],
      "components": [
        {
          "component_id": "primary",
          "root": ".",
          "role": "primary",
          "languages": [
            "C++"
          ],
          "build_entries": [
            {
              "path": "CMakeLists.txt",
              "build_system": "cmake",
              "role": "primary"
            }
          ],
          "evidence": [
            {
              "path": "CMakeLists.txt",
              "kind": "build_file"
            }
          ]
        }
      ]
    },
    {
      "case_id": "cpp-oatpp--oatpp",
      "repository": "oatpp/oatpp",
      "revision": "f83d648fd82dc222ef88aabbafb68efbd7d7bf50",
      "review_status": "agent_reviewed",
      "primary_component_ids": [
        "primary"
      ],
      "components": [
        {
          "component_id": "primary",
          "root": ".",
          "role": "primary",
          "languages": [
            "C++"
          ],
          "build_entries": [
            {
              "path": "CMakeLists.txt",
              "build_system": "cmake",
              "role": "primary"
            }
          ],
          "evidence": [
            {
              "path": "CMakeLists.txt",
              "kind": "build_file"
            }
          ]
        }
      ]
    },
    {
      "case_id": "cpp-wjakob--nanogui",
      "repository": "wjakob/nanogui",
      "revision": "e9ec8a1a9861cf578d9c6e85a6420080aa715c03",
      "review_status": "agent_reviewed",
      "primary_component_ids": [
        "primary"
      ],
      "components": [
        {
          "component_id": "primary",
          "root": ".",
          "role": "primary",
          "languages": [
            "C++"
          ],
          "build_entries": [
            {
              "path": "CMakeLists.txt",
              "build_system": "cmake",
              "role": "primary"
            }
          ],
          "evidence": [
            {
              "path": "CMakeLists.txt",
              "kind": "build_file"
            }
          ]
        }
      ]
    },
    {
      "case_id": "cpp-mikke89--rmlui",
      "repository": "mikke89/RmlUi",
      "revision": "b7b4a0688262832eacf3b9abb41f8bbe73868af8",
      "review_status": "agent_reviewed",
      "primary_component_ids": [
        "primary"
      ],
      "components": [
        {
          "component_id": "primary",
          "root": ".",
          "role": "primary",
          "languages": [
            "C++"
          ],
          "build_entries": [
            {
              "path": "CMakeLists.txt",
              "build_system": "cmake",
              "role": "primary"
            }
          ],
          "evidence": [
            {
              "path": "CMakeLists.txt",
              "kind": "build_file"
            }
          ]
        }
      ]
    },
    {
      "case_id": "cpp-flameshot-org--flameshot",
      "repository": "flameshot-org/flameshot",
      "revision": "24ce091c0f95d0fdfe15cb9c085be88be8195b4f",
      "review_status": "agent_reviewed",
      "primary_component_ids": [
        "primary"
      ],
      "components": [
        {
          "component_id": "primary",
          "root": ".",
          "role": "primary",
          "languages": [
            "C++"
          ],
          "build_entries": [
            {
              "path": "CMakeLists.txt",
              "build_system": "cmake",
              "role": "primary"
            }
          ],
          "evidence": [
            {
              "path": "CMakeLists.txt",
              "kind": "build_file"
            }
          ]
        }
      ]
    },
    {
      "case_id": "cpp-polybar--polybar",
      "repository": "polybar/polybar",
      "revision": "f99e0b1c7a5b094f5a04b14101899d0cb4ece69d",
      "review_status": "agent_reviewed",
      "primary_component_ids": [
        "primary"
      ],
      "components": [
        {
          "component_id": "primary",
          "root": ".",
          "role": "primary",
          "languages": [
            "C++"
          ],
          "build_entries": [
            {
              "path": "CMakeLists.txt",
              "build_system": "cmake",
              "role": "primary"
            }
          ],
          "evidence": [
            {
              "path": "CMakeLists.txt",
              "kind": "build_file"
            }
          ]
        }
      ]
    },
    {
      "case_id": "cpp-twitter--vireo",